{
  "$schema": "https://json-schema.org/draft/2020-12/schema",
  "title": "moduletype",
  "description": "JSON document describing a new module type",
  "type": "object",
  "properties": {
    "version": {
      "description": "Version number of the template. Minor version must be increased with every change. Major version must only be changed when targeting a different API version.",
      "type": "string",
      "pattern": "^\\d{1,2}\\.\\d{1,2}$"
    },
    "id": {
      "description": "Id of the module type. Consists of id of manufacturer followed by id of module type. See documentation for rules.",
      "type": "string",
      "pattern": "^(?=.{1,48}$)(?!.*--)[a-z](?:[a-z-]{0,14}[a-z])?-[a-z0-9](?:[a-z0-9-]*[a-z0-9])?$",
      "maxLength": 48
    },
    "name": {
      "description": "Name of the module as given by manufacturer",
      "type": "string",
      "maxLength": 256
    },
    "manufacturerId": {
      "description": "Id of the manufacturer of the device type.",
      "type": "string",
      "pattern": "^(?!.*--)[a-z](?:[a-z-]{0,14}[a-z])$",
      "maxLength": 16
    },
    "orderCode": {
      "description": "Order code for the device type as used by the manufacturer.",
      "type": ["string", "null"]
    },
    "orderNumber": {
      "description": "Order number for the device type as used by the manufacturer.",
      "type": ["string", "null"]
    },
    "moduleFormFactorId": {
      "description": "Form factor of the module.",
      "type": ["string", "null"],
      "pattern": "^[a-z0-9]+(?:-[a-z0-9]+)*$"
    },
    "spanWidth": {
      "description": "The width of the module in slots",
      "type": "integer"
    },
    "portTypes": {
      "description": "List of all types of ports on the module type.",
      "type": "array",
      "items": {
        "type": "object",
        "properties": {
          "name": {
            "description": "Name of the port, as printed on the module.",
            "type": "string"
          },
          "direction": {
            "description": "Direction of the port type. See documentation for explainations of the possible values.",
            "enum": [
              "IN",
              "OUT",
              "INOUT",
              "BIDI",
              "UP",
              "DOWN",
              "FRONT",
              "REAR"
            ]
          },
          "connectorId": {
            "description": "Id of the connector.",
            "type": "string",
            "pattern": "^[A-Za-z0-9](?:[A-Za-z0-9]|[_.](?=[A-Za-z0-9]))*_(?:f|m|h)$"
          },
          "compatibleSignalTypes": {
            "description": "List of signal types that are compatible with this port.",
            "type": "array",
            "items": {
              "type": "string",
              "pattern": "^(?!.*--)(?:[a-z](?:[a-z-]{0,14}[a-z])?_)?[A-Z0-9]+(?:_[A-Z0-9]+)*$"
            },
            "uniqueItems": true
          }
        },
        "required": [
          "name",
          "direction",
          "connectorId",
          "compatibleSignalTypes"
        ],
        "additionalProperties": false
      }
    },
    "moduleSlotTypes": {
      "description": "List of all types of module slots on the module type.",
      "type": "array",
      "items": {
        "type": "object",
        "properties": {
          "name": {
            "description": "Name of the module slot, as labeled on the module.",
            "type": "string"
          },
          "canSpan": {
            "description": "Indicates wether a module can span into the next slot",
            "type": "boolean"
          },
          "compatibleModuleSlotFormFactors": {
            "description": "List of module slot factors that can physically fit into the slot.",
            "type": "array",
            "uniqueItems": true,
            "items": {
              "type": "string",
              "pattern": "^[a-z0-9]+(?:-[a-z0-9]+)*$"
            }
          },
          "compatibleModuleTypes": {
            "description": "List of module types that are guranteed by the manufacturer to work in this slot.",
            "type": "array",
            "uniqueItems": true,
            "items": {
              "type": "string",
              "pattern": "^(?=.{1,48}$)(?!.*--)[a-z](?:[a-z-]{0,14}[a-z])?-[a-z0-9](?:[a-z0-9-]*[a-z0-9])?$"
            }
          },
          "incompatibleModuleTypes": {
            "description": "List of module types that are guranteed by the manufacturer not work in this module slot.",
            "type": "array",
            "uniqueItems": true,
            "items": {
              "type": "string",
              "pattern": "^(?=.{1,48}$)(?!.*--)[a-z](?:[a-z-]{0,14}[a-z])?-[a-z0-9](?:[a-z0-9-]*[a-z0-9])?$"
            }
          }
        },
        "required": [
          "name",
          "compatibleModuleSlotFormFactors",
          "compatibleModuleTypes",
          "incompatibleModuleTypes"
        ],
        "additionalProperties": false
      }
    }
  },
  "required": ["version", "id", "name", "manufacturerId"],
  "additionalProperties": false
}
