{
  "version": "1.1",
  "id": "lawo-98160-80",
  "name": "981/60-80",
  "orderCode": null,
  "orderNumber": "981/60-80",
  "moduleFormFactorId": "sfp",
  "manufacturerId": "lawo",
  "portTypes": [
    {
      "name": "",
      "direction": "BIDI",
      "connectorId": "LC_DPLX_PC_MM_f",
      "compatibleSignalTypes": ["MADI_MM_1310"]
    }
  ]
}
