{
  "version": "1.0",
  "name": "981/60-82",
  "id": "lawo-98160-82",
  "orderCode": null,
  "orderNumber": "981/60-82",
  "moduleFormFactorId": "sfp",
  "manufacturerId": "lawo",
  "portTypes": [
    {
      "name": "",
      "direction": "IN",
      "connectorId": "HD_BNC_f",
      "compatibleSignalTypes": ["MADI_CU"]
    },
    {
      "name": "",
      "direction": "OUT",
      "connectorId": "HD_BNC_f",
      "compatibleSignalTypes": ["MADI_CU"]
    }
  ]
}
