{
  "version": "1.0",
  "id": "directout-milansgsrcio",
  "name": "MILAN.SG.SRC.IO",
  "orderCode": null,
  "orderNumber": "DONETAS01",
  "moduleFormFactorId": "directout-a-slot",
  "manufacturerId": "directout",
  "portTypes": [
    {
      "name": "MILAN PORT 1",
      "direction": "UP",
      "connectorId": "RJ45_f",
      "compatibleSignalTypes": ["1000BASE_T"]
    },
    {
      "name": "MILAN PORT 2",
      "direction": "UP",
      "connectorId": "RJ45_f",
      "compatibleSignalTypes": ["1000BASE_T"]
    },
    {
      "name": "SOUNDGRID PORT 1",
      "direction": "UP",
      "connectorId": "RJ45_f",
      "compatibleSignalTypes": ["1000BASE_T"]
    },
    {
      "name": "SOUNDGRID PORT 2",
      "direction": "UP",
      "connectorId": "RJ45_f",
      "compatibleSignalTypes": ["1000BASE_T"]
    }
  ]
}
