{
  "version": "1.0",
  "id": "netgear-axm761",
  "name": "AXM761",
  "orderCode": null,
  "orderNumber": null,
  "moduleFormFactorId": "sfpplus",
  "manufacturerId": "netgear",
  "portTypes": [
    {
      "name": "",
      "direction": "UP",
      "connectorId": "LC_DPLX_PC_MM_f",
      "compatibleSignalTypes": ["10GBASE_SR"]
    }
  ]
}
