{
  "version": "1.0",
  "name": "SFP-HDM-IN",
  "id": "ross-sfp-hdm-in",
  "orderCode": null,
  "orderNumber": "SFP-HDM-IN",
  "moduleFormFactorId": "sfp",
  "manufacturerId": "ross",
  "portTypes": [
    {
      "name": "",
      "direction": "IN",
      "connectorId": "HDMI_D_f",
      "compatibleSignalTypes": ["HDMI", "DVI_D", "DVI_I"]
    }
  ]
}
