{
  "version": "1.0",
  "id": "imagine-opqsfpfr100g",
  "name": "OP+QSFP+FR+100G",
  "orderCode": null,
  "orderNumber": "OP+QSFP+FR+100G",
  "moduleFormFactorId": "qsfp28",
  "manufacturerId": "imagine",
  "portTypes": [
    {
      "name": "",
      "direction": "UP",
      "connectorId": "LC_DPLX_PC_SM_f",
      "compatibleSignalTypes": ["100GBASE_FR1"]
    }
  ]
}
