{
  "version": "1.1",
  "name": "SFP+HDMI+OUT",
  "id": "imagine-sfphdmiout",
  "orderCode": null,
  "orderNumber": "SFP+HDMI+OUT",
  "moduleFormFactorId": "sfp",
  "manufacturerId": "imagine",
  "portTypes": [
    {
      "name": "",
      "direction": "OUT",
      "connectorId": "HDMI_D_f",
      "compatibleSignalTypes": ["HDMI", "DVI_D", "DVI_I"]
    }
  ]
}
